{
  "audit_ref": "audit://v7-1/small-studio",
  "created_at": "2026-06-08T08:17:19.742079+00:00",
  "project_id": "project_v7_1",
  "runtime_report_refs": [
    "runtime-report://v6-9/final-acceptance"
  ],
  "tenant_id": "tenant_v7_1",
  "workflow_spec_refs": [
    "workflow-spec://v7-1/local-document-summary"
  ],
  "workspace_id": "workspace_v7_1"
}
